키워드,언론사,게시일,뉴스제목,url,content
롯데 해킹,이코노미스트,2025-10-15 11:20:09,"김병주 MBK 회장, 홈플·롯데카드 사태에 “제가 잘 모르는 사항” 책임 회피",https://n.news.naver.com/mnews/article/243/0000086365?sid=101,"국회 정무위 국정감사에서 김병주 MBK 회장 “홈플러스 회생, 이사회가 정하는 것” 김병주 회장 “저는 총수가 아니다…제 담당파트는 펀드레이징, 자금받은 투자처 관리” 추가 사재출연 요구에 “법인과 개인의 자금여력 현재로선 부족하다” 김병주 MBK파트너스 회장이 지난 14일 국회 정무위원회에서 열린 2025년도 공정거래위원회 국정감사에 증인으로 출석해 의원 질의를 듣다 안경을 고쳐쓰고 있다. [사진 연합뉴스] [이코노미스트 안민구 기자] 홈플러스 기업회생 사태와 롯데카드 해킹 사고 등으로 사회적 논란에 휩싸인 MBK파트너스의 김병주 회장이 국회 국정감사에 증인으로 출석해 ""국민께 심려를 끼쳐드려 죄송하다"" 고개를 숙였다. 그러면서도 대부분의 사안에 대해 “관여하지 않는다” “잘모르는 내용이다”라는 답변으로 일관하면서 여야 의원들의 질타가 쏟아졌다. 지난 14일 국회 정무위원회의 국정감사에 출석한 김병주 MBK파트너스 회장은 홈플러스와 롯데카드에 대해 관여하지 않는다는 취지의 답변을 반복했다. 더불어민주당 김남근 의원이 “사재 출연까지 하겠다면서 대기업으로부터 납품대금을 받는 것에 대한 보증도 못하느냐”고 묻자 김병주 회장은 “제가 관여하는 부분이 아니라서 자세한 말씀을 드리기가 어렵다”고 밝혔다. 홈플러스 자산유동화 전단채(ABSTB) 투자자에 대해 우선 변제와 사재 출연을 약속할 생각이 있느냐는 신장식 조국혁신당 의원 질의에도 ""홈플러스는 제가 관여하는 파트가 아니다""라며 선을 그었다. 민주당 민병덕 의원이 김병주 회장을 상대로 홈플러스의 올 3월 기업회생절차를 신청한 이유를 묻는 질문에 대해선 “회생절차는 제가 권한이 없다”며 “회사의 이사회가 정하는 것”이라고 답했다. 롯데카드 해킹 사태에 대해서도 민 의원이 “어떤 사회적 책임을 지겠느냐”고 질의하자 김병주 회장은 “롯데카드는 제가 잘 모르는 사항”이라고 말했다. 김 회장은 롯데카드와 홈플러스에 대한 의사결정 참여 여부에 대한 민주당 박상혁 의원 질의에는 “저희(MBK)는 대기업이 아니고 저는 총수가 아니다”라며 “13명의 파트너들이 각각 자기 분야를 담당해서 관여를 하는데 제가 담당하는 파트는 펀드레이징, 자금을 일으키는 것이고 그 자금을 받은 투자처들을 관리하는 것”이라고 답변을 내놓기도 했다. 이 같은 김 회장의 태도에 일부 의원은 ""기업 의사결정에는 전혀 참여하지 않느냐""는 질책과 함께 언성을 높이기도 했다. 김 회장이 MBK에 대해 ‘제 회사’라고 표현하며 사회적 책임을 거론하면서도 구체적인 사안에 대해서는 관여하지 않거나 잘 모르는 사항이라는 답변을 지속적으로 내놓자 의원들의 질타는 MBK 김광일 부회장에게로 쏠리기도 했다. 추가로 사재를 출연할 가능성에 대해서는 김 회장은 “법인과 개인의 자금여력이 현재로선 부족하다”며 부정적인 입장을 취했다. 한창민 사회민주당 의원은 “무책임한 거짓말로 국민을 기만하면서 사회적 책임을 다한다고 하는데, 무슨 책임을 졌나”고 따지면서 “다른 기업으로 매각할 경우 입점 업체가 피해를 입지 않도록 사재출연을 하든 어떤 계획을 내놓아야 한다”고 질타했다. 김병주 MBK파트너스 회장(오른쪽)과 김광일 홈플러스 대표이사가 14일 서울 여의도 국회에서 열린 공정거래위원회, 개인정보보호위원회 등에 대한 정무위원회 국정감사에 증인으로 출석해 대화하고 있다. [사진 연합뉴스] 김병주 회장을 대한 검은머리 외국인 논란과 자본시장법, 특정 경제 가중처벌법상 사기 등 혐의에 대한 수사당국의 엄중 조치를 요구하는 의원들의 발언도 이어졌다. 민주당 김현정 의원은 김병주 회장에 대해 “이중 국적도 아니에요 검은머리 외국인입니다, 그 자체로. 그래서 이름이 마이클 병주 김”이라며 “외국인이기 때문에 출국 금지가 아니라 출국 정지를 당한 것”이라고 강조했다. 이어 출입국 관리법 11조 4호에 경제 질서를 해치는 행동을 할 염려가 있다고 인정할 만한 상당한 이유가 있는 외국인에 대해서는 입국 금지를 할 수 있도록 돼 있다며 국민연금의 9000억 손실 위기와 함께 투자 기업은 파산으로 몰아가고, 노동자를 길거리로 내모는 행태를 지적하며 입국 금지 조치를 신청해야 한다고 주장했다. 정무위에 출석한 주병기 공정거래위원장은 ""MBK가 한국 경제에서 누린 수익에 상응하는 사회적 책임은 상당히 중요하다""며 ""공정위는 사회적 책임의 중대성을 충분히 반영해 위법행위에 대해 엄정히 제재하겠다""고 입장을 밝혔다."
롯데 해킹,머니S,2025-10-15 13:42:11,"'홈플러스·롯데카드 사태' 국감 질타에 MBK 김병주 ""관여 안했다""",https://n.news.naver.com/mnews/article/417/0001106680?sid=101,"지난 14일 정무위 국정감사에 증인으로 출석한 김병주 MBK파트너스 회장./사진=뉴스1 국정감사에 홈플러스 기업회생·롯데카드 해킹 사고 등 사회적 논란으로 출석한 김병주 MBK파트너스 회장이 대부분 사안을 두고 ""관여하지 않았다""고 답했다. 여야 의원이 질타했지만 ""잘모르는 내용""이라며 답변을 피했고 향후 사재 출연 계획 등에 대한 질의에는 구체적인 답변을 내놓지 않았다. 15일 재계에 따르면 김 회장은 전날 국회 정무위원회 국감에 출석해 논란이 된 사안들에 대해 직접적인 개입은 없었다고 부인했다. 고개를 숙이며 ""죄송하다""고 말하기도 했지만 구체적인 해결책을 내놓지 않고 대답을 피해 이번 국감만으로 홈플러스 사태와 롯데카드 해킹 사고가 마무리되지 않을 것이라는 전망이 나온다. 홈플러스 사태를 두고 국회위원들의 질의가 거셌다. 김남근 더불어민주당 의원은 ""사재 출연까지 하겠다면서 대기업으로부터 납품대금을 받는 것에 대한 보증도 못하느냐""고 묻자 김 회장은 ""제가 관여하는 부분이 아니라서 자세한 말씀을 드리기가 어렵다""고 했다. 신장식 조국혁신당 의원이 법위를 좁혀 홈플러스 자산유동화 전단채 투자자에 대한 우선 변제·사재 출연을 묻자 또다시 ""제가 관여하는 파트가 아니다""라고 답을 피했다. 홈플러스 기업회생절차가 갑작스레 이뤄진 배경에 대해서도 물었다. 민병덕 민주당 의원이 기업회생절차 신청 이유를 묻자 김 회장은 ""회생절차는 제게 권한이 없다""며 ""회사의 이사회가 정하는 것""이라고 말했다. 롯데카드 해킹 사태에 대한 사회적 책임을 묻는 질문에도 김 회장은 ""잘모르는 사항""이라며 답변을 하지 않았다. MBK파트너스가 롯데카드를 인수한 이후 보안 관련 예산이 줄은 것 아니냐는 질의에는 김광일 MBK파트너스 부대표가 ""그렇지 않다고 생각한다""고 답했다. 김 회장은 MBK파트너스 총수가 자신이 아니라고 답하며 책임을 피했다. 그는 ""13명의 파트너들이 각각 자기 분야를 담당해서 관여를 하는데 제가 담당하는 파트는 펀드레이징. 자금을 일으키는 것이고 그 자금을 받은 투자처들을 관리하는 것""이라고 했다. 정무위에 출석한 주병기 공정거래위원장은 ""MBK가 한국 경제에서 누린 수익에 상응하는 사회적 책임은 상당히 중요하다""며 ""공정위는 사회적 책임의 중대성을 충분히 반영해 위법행위에 대해 엄정히 제재하겠다""고 입장을 밝혔다."
롯데 해킹,머니투데이,2025-10-13 11:04:56,"롯데카드, 카드 재발급 조치 대부분 완료… ""부정사용 사례 없어""",https://n.news.naver.com/mnews/article/008/0005261620?sid=101,"부정사용 가능성 28만명 고객 중 22만명이 카드 재발급 신청 일부 특수카드 제외 대부분 완료 재발급 안 된 카드, 15일부터 해외 결제 원천 차단 롯데카드 해킹 사태로 피해를 입은 고객의 카드 재발급 조치가 대부분 완료됐다. 카드 발급 지연 현상이 해소돼 지체 없이 즉시 재발급이 가능해졌다. 롯데카드는 ""일부 키인(KEY IN) 거래를 통한 부정사용 가능성이 존재하는 고객 28만명 중 카드 재발급을 신청한 고객에 대한 재발급 조치가 완료됐다""고 13일 밝혔다. 지난달 1일부터 전날까지 28만명 고객 중 카드 재발급 신청 건수는 약 22만 건이다. 일부 특수 카드를 제외하곤 재발급 조치가 완료됐다. 같은 기간 롯데카드 전체 고객의 카드 재발급 신청 건수는 약 121만건이다. 98%에 해당하는 약 119만건에 재발급이 완료됐다. 하루 최대 카드 발급량 확대, 충분한 공카드 물량 확보 등으로 재발급 지연 현상이 해소됐다. 일부 특수카드를 제외한 모든 카드에 대기나 지연 없이 신청 즉시 재발급이 가능해졌다. 28만명 중 카드 재발급 포함, 비밀번호 변경, 카드 정지 및 해지 등 고객 보호조치가 완료된 고객은 약 23만명(82%)이다. 아직 카드 재발급을 신청하지 않은 고객에는 지속적으로 재발급을 안내할 예정이다. 오는 15일부터는 해당 카드의 온라인 가맹점 이용을 제한해 부정 결제 가능성을 원천적으로 차단할 계획이다. 고객정보가 유출된 전체 고객 297만명 중에선 49%에 해당하는 약 146만명에 카드 재발급 신청, 비밀번호 변경, 카드 정지·해지 등 고객 보호조치가 완료됐다. 다만 297만명 중 28만명을 제외한 269만명은 유출된 정보만으로 카드 부정사용 발생 가능성이 없어 카드 재발급을 별도로 할 필요가 없다는 게 롯데카드 측 설명이다. 297만명 중 회원을 탈퇴한 고객은 3만715명이다. 카드 정지는 18만1990명, 카드 해지는 5만6522명이다. 롯데카드는 이번 해킹 사태로 인한 부정사용 시도나, 실제 소비자 피해는 단 한 건도 확인되지 않았다고 강조했다."
롯데 해킹,뉴스1,2025-10-14 05:30:00,"국감 2일차, 과방위에 이진숙 출석…법사위 '특검·양평' 정무위 '해킹'",https://n.news.naver.com/mnews/article/421/0008535616?sid=100,"국힘, 검찰개혁안도 검증…민주, 특검 수사 통한 尹의혹 공격 '장관 청문회 2탄' 예고된 교육위…'정조법·캄보디아' 행안위 추미애 국회 법제사법위원장이 지난 13일 서울 여의도 국회에서 열린 제429회 국회(정기회) 법제사법위원회 제8차 전체회의에서 의사봉을 두드리고 있다. 2025.10.13/뉴스1 ⓒ News1 유승관 기자 (서울=뉴스1) 서상혁 기자 = 국정감사 2일 차인 14일에도 여야의 주 무대는 법제사법위원회가 될 전망이다. 국민의힘은 법무부를 상대로 최근 특검의 수사를 받다가 사망한 양평군 공무원부터 검찰개혁의 타당성 등을 집중 추궁할 방침이다. 더불어민주당은 반대로 특검 수사를 통해 제기된 의혹들을 바탕으로 공세를 펼 것으로 보인다. 국회는 이날 서울 여의도 국회에서 법무부, 대한법률구조공단, 한국법무보호복지공단, 정부법무공단을 상대로 국정감사를 실시한다. 법무부가 특검을 실무 지원하는 만큼 국민의힘은 법무부에 양평군 공무원 사망 문제를 강하게 제기할 방침이다. 국민의힘은 국회 정문에 고인을 추모하는 합동분향소를 차리고 정부·여당을 강하게 비판하고 있다. 앞서 윤석열 전 대통령 부인 김건희 여사 관련 의혹을 수사 중인 민중기 특별검사팀에 출석해 조사받은 경기 양평군청 소속 공무원이 숨진 채 발견됐다. 고인은 ""모른다고 기억 안 난다고, 사실대로 말을 해도 계속 다그친다. 사실을 말해도 거짓이라고 한다""는 메모를 남겼다. 국민의힘은 이와 함께 검찰청을 폐지하고 중대범죄수사청(중수청) 등으로 나눈 여권의 검찰개혁안에 대해서도 강도 높은 검증에 나서겠다는 계획이다. 민주당은 김건희·내란·순직해병 등 3대 특검 수사를 통해 윤곽이 드러나고 있는 윤석열 정권 관련 의혹들을 무기로 삼아 공격에 나설 전망이다. 국회 정무위원회는 공정거래위원회, 개인정보보호위원회, 한국소비자원, 한국공정거래조정원을 상대로 국감을 진행한다. 이날 국감에는 김범석 쿠팡INC 의장과 김명규 쿠팡이츠 대표 등 각종 플랫폼 기업 인사들이 대거 증인으로 채택됐다. 김 의장은 해외 체류를 이유로 국감 불출석 의사를 밝혔다. 다만 전날(13일) 정무위는 오는 28일 열리는 정무위의 비금융분야 종합감사 증인으로 김 의장을 재차 채택했다. 여야는 가맹점, 플랫폼 불공정 거래 관련 이슈를 추궁할 전망이다. 롯데카드 해킹 문제와 관련해서는 조좌진 롯데카드 대표와 롯데카드 및 홈플러스 대주주인 MBK파트너스 회장 김병주 씨도 증인으로 채택됐다. 이진숙 전 방송통신위원장이 지난 4일 오후 서울 영등포경찰서에서 석방돼 귀가하고 있다. 2025.10.4/뉴스1 ⓒ News1 신윤하 기자 국회 교육위원회는 교육부, 국가교육위원회, 국사편찬위원회 등을 대상으로 감사를 진행한다. 최교진 교육부 장관에 대한 인사청문경과보고서가 여당 단독으로 채택된 만큼 국민의힘 의원들은 국감에서 '인사청문회 2탄'을 예고한 상태다. 김건희 여사에게 금거북이를 건네고 국가교육위원장직을 청탁했다는 의혹을 받는 이배용 전 위원장은 불출석하는 것으로 알려졌다. 과학기술정보방송통신위원회는 얼마 전까지만 해도 방송통신위원회로 불렸던 방송미디어통신위원회와 함께 방송미디어통신사무소, 시청자미디어재단, 한국방송광고진흥공사를 상대로 국감을 진행한다. 이 자리에는 추석 연휴 전 경찰에 체포됐던 이진숙 전 방통위원장을 비롯해 김영섭 KT 대표도 증인으로 출석할 예정이다. 특히 이 전 위원장이 앞서 법원의 체포적부심 인용으로 석방된 만큼 여야는 이 문제를 두고 격돌할 전망이다. 이밖에 행정안전위원회 국감에서는 검찰개혁 등이 담긴 정부조직법 개정안의 후속조치를 두고 여야 공방이 이어질 전망이다. 또 경찰을 관할하는 행정안전부가 출석하는 만큼 최근 캄보디아에서 빈번히 벌어진 한국인 대상 납치·살해 사건에 대한 국회의 대책 촉구가 있을 것으로 보인다."
롯데 해킹,블로터,2025-10-15 14:52:06,"조좌진 롯데카드 대표, 해킹 수습·실적 부진·국감 압박…관건은 신뢰 회복",https://n.news.naver.com/mnews/article/293/0000073575?sid=101,"조좌진 롯데카드 대표가 9월18일 서울 중구 부영태평빌딩에서 열린 '롯데카드 고객정보 유출 관련 언론 브리핑'에서 발언하고 있다. /사진=김홍준 기자 롯데카드가 대규모 개인정보 유출 사태의 뒷수습을 위해 총력을 기울이는 가운데 실적 둔화와 국정감사 압박까지 겹치며 고역을 치르고 있다. 조좌진 대표가 대규모 복구·보안 투자를 본격화함에 따라 신뢰 회복의 전환점이 될 수 있을지 관심이 집중된다. 15일 금융권에 따르면 조 대표는 사고 이후 직접 컨트롤타워 역할을 맡아 대응 상황을 총괄하고 있다. 회사는 단기 복구를 넘어 정보보호 인프라 전면 개편을 추진하며 신속한 대책 마련에 나섰다. 이번 사고는 7월22일부터 8월27일까지 롯데카드로 온라인결제를 이용한 회원을 대상으로 일어났다. 총 297만명의 개인정보가 유출된 것으로 확인됐으며 카드번호·유효기간·카드보안코드(CVC)까지 노출된 28만명은 부정 사용 위험이 높은 그룹으로 분류됐다. 롯데카드는 카드 재발급·이용 정지·비밀번호 변경 등 긴급 보호 조치를 시행했다. 현재 고위험 고객 28만명 중 82%인 23만417명이 카드 재발급, 비밀번호 변경, 카드 정지·해지 등 보호조치를 마쳤다. 카드 재발급 신청 21만6182건 가운데 일부 특수카드를 제외한 21만5240건의 발급도 완료됐다. 현재까지 공식적으로 확인된 부정 사용 피해 사례는 없는 것으로 알려졌다. 롯데카드는 복구 지연 해소를 위해 공(空)카드 물량을 추가 확보하고, 야간까지 운영되는 전담 상담 채널을 신설했다. 15일부터는 재발급 신청을 하지 않은 고위험 고객의 카드 이용을 일시적으로 제한해 부정 사용 가능성을 차단하기로 했다. 피해 고객 전원에게는 전액 보상 원칙을 적용하고 무이자 10개월 할부, 연회비 면제 등의 혜택도 함께 제공한다. 이번 사태에서 논란이 되는 부분은 롯데카드의 정보기술(IT) 투자 규모가 사모펀드(PEF) 운용사 MBK파트너스 인수 이후로 줄어들었다는 의혹이다. 강민국 국민의힘 의원실이 금융감독원 자료를 분석한 결과에 따르면 롯데카드의 지난해 정보보호 예산(인건비 제외)은 96억5600만원으로 전체 IT 예산 1078억4400만원의 9.0%다. 조좌진 롯데카드 대표가 9월18일 서울 중구 부영태평빌딩에서 열린 '롯데카드 고객정보 유출 관련 언론 브리핑'에서 정보보안 운영 현황 및 투자 계획을 발표하고 있다. /사진=김홍준 기자 다만 실제 금액을 살펴보면 롯데카드의 IT 보안 투자 규모는 꾸준한 증가세를 나타냈다. 롯데카드에 따르면 보안 투자 예산은 2020년 69억원에서 △2021년 137억원 △2022년 88억5000만원 △2023년 115억원 △2024년 117억원 △2025년 128억1000만원으로 늘었다. 롯데카드가 사고 이후 2개월간 집행한 예산 규모도 180억원에 이른다. 여기에는 콜센터 운영, 카드 재발급, 정보보호 관련 예산 등이 포함됐다. 롯데카드는 향후 5년간 1100억원 규모의 정보보호 투자를 진행해 IT 전체 예산 대비 정보보호 예산의 비중을 업계 최고 수준인 15%까지 키우겠다는 계획이다. 조 대표 또한 국정감사에서 ""연말까지 1100억원 규모의 정보보호 투자 계획을 이사회에 보고하겠다""고 밝혔다. 공개적 약속으로 '책임경영' 의지를 강조한 셈이다. 롯데카드는 이번 사고 수습 과정에서 피해 및 극복 현황을 투명하게 공개하며 고객과의 소통에 집중하는 모습을 보였다. 피해 유형별 안내 페이지를 마련해 재발급·해외 결제 차단·비밀번호 변경 절차를 단계별로 안내하고, 고객별 조치 현황을 문자 및 앱 알림으로 병행했다. 문제는 이번 사태의 여파가 롯데카드의 실적에도 영향을 미칠 가능성이 높다는 점이다. 피해 복구를 위해 사용하는 단기 비용 증가 때문이다. 한국기업평가는 최근 발표한 보고서에서 ""고객정보 유출 사고 발생은 실적 회복에 상당한 걸림돌로 작용할 전망""이라고 진단했다. 롯데카드의 상반기 순이익은 지난해 같은 기간(628억원)과 비교해 33.8% 감소한 416억원을 기록했다. 가맹점 수수료 인하 및 홈플러스 채권 관련 신용손실충당금 적립액으로 4309억원을 쌓은 결과 순익이 감소했다. 그럼에도 상반기 말 자기자본이익률(ROE)은 2.70%로 지난해 말(2.03%)보다 0.67%p 상승했고, 총자산수익률(ROA)은 0.40%로 작년 12월(0.31%) 대비 0.09%p 오르는 등 수익성 지표에서의 개선세가 나타났다. 베트남 해외법인 롯데파이낸스베트남의 상반기 영업이익은 483억3500만원, 순이익이 33억8500만원으로 증가하며 글로벌 영업 기반을 쌓기도 했다. 결국 롯데카드의 신뢰 회복은 실행력에서 가늠할 수 있을 것으로 전망된다. 금융권에서는 롯데카드의 대규모 보안 투자 계획이 실제 체질 개선으로 이어지는지 여부를 반등의 핵심 변수로 보고 있다. 업계 한 관계자는 ""이번 대응 과정이 신뢰 회복의 첫 시험대""라며 ""투명한 정보 공개와 계획 이행 속도가 중요할 것""이라고 말했다."
롯데 해킹,SBS Biz,2025-10-14 17:33:09,"조좌진 롯데카드 대표 ""1100억 정보보호 투자 계획 연말까지 수립"" [2025 국감]",https://n.news.naver.com/mnews/article/374/0000468383?sid=101,"[조좌진 롯데카드 대표이사(왼쪽)가 14일 서울 영등포구 여의도 국회에서 열린 공정거래위원회, 개인정보보호위원회 등에 대한 정무위원회 국정감사에 증인으로 출석, 의원 질의에 답하고 있다. 왼쪽 두 번째는 김병주 MBK파트너스 회장 (사진=연합뉴스)] 조좌진 롯데카드 대표가 연말까지 1,100억원 규모의 정보보호 투자 계획을 수립하겠다고 밝혔습니다. 조좌진 대표는 오늘(14일) 국회에서 열린 정무위원회 국정감사에 증인으로 참석해, 5년간 1100억원 규모의 정보보호 투자와 관련해서 연말까지 구체적인 계획을 세워 이사회에 보고하겠다고 말했습니다. 또한, 조좌진 대표는 해킹 사고 발생 이후 롯데카드가 정보보호 관련 예산을 늘리지 않았다는 김재섭 국민의힘 의원의 지적에 ""미리 편성된 예산 기준으로 그런 것이고, 사건 이후 9∼10월에 콜센터 운영, 카드 재발급, 정보 보호 관련 예산 포함해 180억원 정도가 소요됐다""고 답했습니다. 어제(13일) 롯데카드는 해킹 사고로 민감정보가 유출돼 부정사용 피해 가능성이 있는 고객 28만명 중 약 23만명을 대상으로 카드 재발급과 비밀번호 변경, 카드 정지 및 해지 등 보호조치를 했다고 밝힌 바 있습니다. 이어 고객정보가 유출된 전체 고객 297만명 중에는 약 146만명을 대상으로 보호조치를 완료했다고 덧붙였습니다. 당신의 제보가 뉴스로 만들어집니다. SBS Biz는 여러분의 제보를 기다리고 있습니다. 홈페이지 = https://url.kr/9pghjn"
