키워드,언론사,게시일,뉴스제목,url,content
롯데 보안사고,부산일보,2025-09-18 14:52:10,고객 정보 다 뚫린 롯데카드…해킹 사태로 ‘300만 명’ 피해(종합),https://n.news.naver.com/mnews/article/082/0001345500?sid=101,"고객 297만 명 정보 유출 “28만 명 정보는 부정사용 가능성” “전사적 비상대응체계”…조좌진 대표 사과 회원 960만여 명을 보유한 롯데카드의 ‘해킹 사태’ 피해 규모가 예상보다 훨씬 큰 것으로 밝혀지며 논란이다. 조좌진 롯데카드 대표이사 등 관계자들이 18일 서울 중구 부영태평빌딩에서 해킹 사고로 인한 고객 정보 유출사태에 대해 대고객 사과를 위해 서있다. 연합뉴스 회원 960만여 명을 보유한 롯데카드의 ‘해킹 사태’ 피해 규모가 예상보다 훨씬 큰 것으로 밝혀지며 논란이다. 당초 피해 규모가 크지 않다는 설명과 달리 300만 명에 가까운 고객들의 주민등록번호 등 민감한 개인정보가 대거 유출된 것으로 파악됐다. 조좌진 롯데카드 대표는 이날 오후 서울 중구 부영태평빌딩에서 기자회견을 열어 “고객 여러분과 유관 기관 여러분께 심려를 끼쳐 진심으로 죄송하다”고 밝혔다. 롯데카드는 약 960만 명의 회원을 보유한 업계 5위권 카드회사로, 전체의 약 3분의 1에 가까운 회원 정보가 유출된 셈이다. 유출이 확인된 회원 정보는 온라인 결제 과정에서 생성·수집된 데이터로 △연계 정보(CI) △주민등록번호 △가상 결제코드 △내부 식별번호 △간편결제 서비스 종류 등이다. 조 대표는 “전체 유출 고객 중 유출된 고객 정보로 카드 부정 사용이 발생할 가능성이 있는 고객은 총 28만 명”이라며 “유출 정보 범위는 카드번호, 유효기간, CVC번호 등”이라고 말했다. 단말기에 카드 정보를 직접 입력해 결제하는 키인(Key in) 거래 시 부정사용 가능성이 있다. 정보가 유출된 고객들은 7월 22일과 8월 27일 사이 새로운 페이결제 서비스나 커머스 사이트에 사용 카드정보를 신규 등록한 고객이다. 조 대표는 “나머지 269만 명은 일부 항목만 제한적으로 유출됐다”며 “해당 정보만으로 카드 부정사용이 발생할 가능성은 없다”고 말했다. 피해 구제 방안으로는 전액 보상 방침을 밝혔다. 조 대표는 “이번 사고로 발생한 피해는 롯데카드가 책임지고 피해액 전액을 보상할 것”이라며 “2차 피해도 연관성이 확인되면 전액 보상하겠다”고 말했다. 이 밖에 고객 정보가 유출된 고객 전원에게 연말까지 결제 금액과 관계 없이 무이자 10개월 할부 서비스를 무료로 제공하기로 했다. 아울러 카드 재발급 대상인 28만 명에게는 재발급 시 다음 해 연회비를 한도 없이 면제하기로 했다. 롯데카드는 이번 사고를 계기로 보안 조치를 강화할 계획이다. 조 대표는 “고객 피해 제로화를 최우선 과제로 삼고 대표이사 주재로 전사적 비상대응체계를 가동하겠다”고 밝혔다. 특히 앞으로 5년 동안 1100억 원 규모의 정보보호 관련 투자를 집행, 자체 보안 관제 체계를 구축하기로 했다. 당초 롯데카드가 금감원에 보고한 유출 데이터 규모는 1.7기가바이트(GB) 수준이었지만, 금융당국 현장 검사 등을 통해 파악된 피해 규모는 200GB 분량으로 나타났다. 또 처음 해킹 사고가 발생한 것은 지난달 14일이었으나, 회사 측은 월말이 돼서야 사태를 파악하고 조사에 나섰다. 한편 이재명 대통령은 “최근 통신사, 금융사에서 해킹 사고가 잇따르고 있어 국민이 매우 불안해 하신다”며 “보안 사고를 반복하는 기업들에 징벌적 과징금을 포함한 강력한 대처가 이뤄지도록 관련 조치를 신속히 준비하라”고 지시한 바 있다."
롯데 보안사고,강원일보,2025-09-18 14:28:09,"롯데카드 ""해킹 사고로 297만명 고객 정보 유출…28만명 정보는 부정 사용 가능성""",https://n.news.naver.com/mnews/article/087/0001143474?sid=102,"""피해 발생 시 전액 보상…전사적 비상대응체계""…조좌진 대표 사과 ◇조좌진 롯데카드 대표이사 등 관계자들이 18일 서울 중구 부영태평빌딩에서 해킹 사고로 인한 고객 정보 유출사태에 대해 대고객 사과를 하고 있다. 2025.9.18 사진=연합뉴스 이동통신사에 이어 롯데카드에서도 대규모 해킹 사건이 발생하면서 정부 차원의 사이버보안 공조 체계를 정비해야 한다는 지적이 제기된 가운데 롯데카드가 18일 외부 해킹 공격으로 297만명의 고객 정보가 유출된 것으로 확인됐다고 밝혔다. 조좌진 롯데카드 대표는 이날 오후 서울 중구 부영태평빌딩에서 기자회견을 열어 ""고객 여러분과 유관 기관 여러분께 심려를 끼쳐 진심으로 죄송하다""며 이같이 밝혔다. 롯데카드는 약 960만명의 회원을 보유한 업계 5위권 카드회사로, 전체의 약 3분의 1에 가까운 회원 정보가 유출된 셈이다. 유출이 확인된 회원 정보는 온라인 결제 과정에서 생성·수집된 데이터로 연계 정보(CI), 주민등록번호, 가상 결제코드, 내부 식별번호, 간편결제 서비스 종류 등이다. 조 대표는 ""전체 유출 고객 중 유출된 고객 정보로 카드 부정 사용이 발생할 가능성이 있는 고객은 총 28만명""이라며 ""유출 정보 범위는 카드번호, 유효기간, CVC번호 등""이라고 말했다. 이들의 경우 단말기에 카드 정보를 직접 입력해 결제하는 키인(Key in) 거래 시 부정사용 가능성이 있다고 조 대표는 설명했다. 이어 ""해당 고객은 7월 22일과 8월 27일 사이 새로운 페이결제 서비스나 커머스 사이트에 사용 카드정보를 신규 등록한 고객""이라며 ""카드 재발급 조치가 최우선적으로 이뤄지도록 하겠다""고 말했다. 조 대표는 이어 ""나머지 269만명은 일부 항목만 제한적으로 유출됐다""며 ""해당 정보만으로 카드 부정사용이 발생할 가능성은 없다""고 말했다. 그러면서 ""정보 유출은 온라인 결제 서버에 국한해 발생했으며, 오프라인 결제와는 전혀 무관하다""며 ""고객 성명도 유출되지 않았다""고 설명했다. ◇조좌진 롯데카드 대표이사가 18일 서울 중구 부영태평빌딩에서 해킹 사고로 인한 고객 정보 유출사태에 대한 사과문을 발표하고 있다. 2025.9.18 사진=연합뉴스 피해 구제 방안으로는 전액 보상 방침을 밝혔다. 조 대표는 ""이번 사고로 발생한 피해는 롯데카드가 책임지고 피해액 전액을 보상할 것""이라며 ""2차 피해도 연관성이 확인되면 전액 보상하겠다""고 말했다. 이밖에 고객 정보가 유출된 고객 전원에게 연말까지 결제 금액과 관계 없이 무이자 10개월 할부 서비스를 무료로 제공하기로 했다. 아울러 카드 재발급 대상인 28만명에게는 재발급 시 다음 해 연회비를 한도 없이 면제하기로 했다. 앞서 롯데카드는 지난 1일 해킹 공격을 당해 1.7GB 규모의 데이터가 유출됐다고 금융당국에 신고했다. 하지만 조사 결과 실제 유출 규모는 이보다 훨씬 큰 것으로 드러났다. 처음 해킹 사고가 발생한 것은 지난달 14일이었으나, 회사 측은 월말이 돼서야 사태를 파악하고 조사에 나섰다. 조 대표는 사고 경과와 관련, ""8월 26일 온라인 결제 서버에서 외부 해커 침해 흔적을 발견했다""며 ""31일 1.7GB 분량의 데이터 반출을 시도한 흔적을 발견했다""고 설명했다. 이어 ""9월 2일부터 금융감독원과 금융보안원 현장 검사가 진행됐고, 200GB 분량의 데이터가 추가 반출된 정황을 발견했다""며 ""어제 특정 고객의 일부 고객 정보가 유출된 사실을 최종 확인했다""고 전했다. 롯데카드는 이번 사고를 계기로 보안 조치를 강화할 계획이다. 조 대표는 ""고객 피해 제로화를 최우선 과제로 삼고 대표이사 주재로 전사적 비상대응체계를 가동하겠다""고 밝혔다. 특히 앞으로 5년 동안 1천100억원 규모의 정보보호 관련 투자를 집행, 자체 보안 관제 체계를 구축하기로 했다. 조 대표는 ""대표이사인 저를 포함해 대대적인 인적 쇄신을 연말까지 완료하겠다""며 ""고객 피해를 제로화하고 불편을 최소화하는 임무가 대표로서의 마지막 책무""라고 덧붙였다. ◇960만여명의 회원을 보유한 롯데카드의 '해킹 사고' 피해 규모가 예상보다 훨씬 큰 것으로 파악되면서 피해자 규모가 수십만∼수백만명에 달할 수 있다는 관측까지 제기되고 있는 17일 서울 종로구 롯데카드 본사 모습. 2025.9.18 사진=연합뉴스 한편 KT 무단 소액결제 사건의 피의자가 이날 구속 전 피의자 심문(영장실질심사)을 받기 위해 법원에 출석했다. KT 이용자들의 휴대전화를 해킹해 소액결제 한 혐의를 받는 중국 국적의 중국교포 A(48)씨는 ""누구의 지시를 받은 것인가"", ""펨토셀은 어디서 구했나"", ""범행 동기는 무엇인가"" 등 취재진의 질문에 묵묵부답으로 일관했다. 범행 자금을 현금화한 혐의를 받는 B(44)씨도 ""통신사에서 일한 적 있나"", ""KT 내부자와 관계가 있나"", ""(A씨와) 둘이 공모했나"" 등 질문에 일체 답하지 않았다. 이들은 호송 차량 2대에 각각 올라탄 뒤 곧바로 법원으로 향했다. 이들은 이날 오전 10시 30분 수원지법 안산지원에서 영장실질심사를 받은 뒤 다시 경찰서 유치장으로 돌아와 심사 결과를 기다릴 것으로 보인다. 구속 영장 발부 여부는 이날 오후나 저녁, 늦어도 이튿날 오전 중에 결정될 전망이다. ◇KT 무단 소액결제 사건의 피의자인 중국 국적 남성 A씨(왼쪽)와 B씨가 18일 구속 전 피의자 심문(영장실질심사)에 출석하기 위해 경기도 수원영통경찰서 유치장에서 나오고 있다. 2025.9.18 사진=연합뉴스"
롯데 보안사고,TV조선,2025-09-18 16:21:06,"롯데카드 ""해킹 사고로 200GB 유출…피해 고객 297만명""",https://n.news.naver.com/mnews/article/448/0000557917?sid=101,"/TV조선 방송화면 캡처 롯데카드가 외부 해킹공격으로 297만 명의 고객 정보가 유출됐다고 18일 밝혔다. 조좌진 롯데카드 대표는 이날 서울 중구 부영태평빌딩에서 기자회견을 열고 ""고객 여러분께 심려를 끼쳐 진심으로 죄송하다""며 이같이 밝혔다. 롯데카드는 약 960만 명의 회원을 보유한 업계 5위권 카드회사다. 유출된 것으로 확인된 회원 정보는 ▲주민등록번호 ▲가상 결제코드 ▲내부 식별번호 ▲간편결제 서비스 종류 등이다. 개인정보가 유출된 고객 중 28만 명은 카드번호, 유효기간, CVC번호 등도 유출된 것으로 파악됐다. 조 대표는 이들의 경우 단말기에 카드 정보를 직접 입력해 결제하는 키인(Key in) 거래를 활용한 부정거래 가능성이 있다고 설명했다. 이어 ""해당 고객은 8월 22일과 8월 27일 사이 새로운 페이결제 서비스나 커머스 사이트에 사용 카드정보를 신규 등록한 고객""이라며 ""카드 재발급 조치가 최우선적으로 이뤄지도록 하겠다""고 했다. 그러면서 ""정보 유출은 온라인 결제 서버에 국한해 발생했으며, 오프라인 결제와는 무관하다""고 설명했다. 조 대표는 ""이번 사고로 발생한 피해는 롯데카드가 책임지고 피해액 전액을 보상할 것""이라며 ""2차 피해도 연관성이 확인되면 전액 보상하겠다""고 말했다. 이밖에 고객 정보가 유출된 고객 전원에게 연말까지 결제 금액과 관계 없이 무이자 10개월 할부 서비스를 무료 제공하기로 했다. 롯데카드는 이번 사고를 계기로 보안 조치를 강화할 방침이다. 5년 동안 1100억 원 규모의 정보보호 관련 투자를 집행하고, 자체 보안 관제 체계를 구축할 예정이다. 조 대표는 ""대표이사인 저를 포함해 대대적인 인적 쇄신을 연말까지 완료하겟다""며 ""고객 피해를 제로화하고 불편을 최소화하는 임무가 대표로서의 마지막 책무""라고 덧붙였다."
롯데 보안사고,디지털타임스,2025-10-12 17:39:23,[맹준호 칼럼] ‘정보보안 컨트롤타워’를 세워라,https://n.news.naver.com/mnews/article/029/0002986531?sid=110,"맹준호 부국장 겸 IT바이오부장 지난 8월 7일(현지시간)부터 10일까지 미국 라스베이거스에서 열린 해킹·정보보안 국제대회 겸 콘퍼런스 ‘데프콘’(Def Con)에선 해킹 전문 계간지 ‘프랙 매거진’(Phrack Magazine)이 현장 배포됐다. 데프콘은 1993년부터 매년 열리는 세계 최고 권위의 해킹 컨벤션이다. 프랙은 해킹·보안 분야에서 최고의 권위를 인정받는 기술 간행물이다. 세계 최고의 해커들이 모인 행사에서 배포된 프랙엔 한국에 관한 충격적인 내용이 담겨 있었다. ‘지능형지속위협 다운: 북한 파일들’(APT Down: The North Korea Files)이란 제목의 보고서는 북한이 배후로 추정되는 해커에게 행정안전부, 외교부 등 중앙부처를 비롯해 국군방첩사령부, 대형 통신사의 정보가 털린 사실을 확인했다고 전했다. 이 보고서는 한 화이트해커가 ‘킴’(KIM)이라고 불리는 공격자의 컴퓨터를 해킹해 발견한 파일들을 바탕으로 작성됐다. 킴의 컴퓨터를 들여다봤더니 행안부가 관리하는 범정부 업무처리 시스템 ‘온나라 시스템’에서 빼 온 자료와 외교부 이메일 관련 파일이 들어있었다는 것이다. 뿐만 아니라 방첩사의 스피어 피싱 공격 로그가 발견됐고, 통신사의 원격 제어 서비스 시스템용 인증서와 내부 서버용 비밀번호가 대량으로 들어 있었다. 국가와 기업의 기밀, 더 나아가 국민 개인정보 탈취로 이어질 수 있는 정보까지 해커의 컴퓨터에 들어 있었던 것이다. 보고서 작성자는 킴을 북한 정찰총국 산하 해커조직인 ‘킴(김)수키’를 의미하는 것으로 추정했지만 일부 전문가들은 중국이 배후인 공격자일 수도 있다고 본다. 미국에서 프랙 보고서가 배포된 직후 국내 보안 관련 전문매체가 이 내용을 보도했지만 일반인들은 큰 관심을 갖지 않았다. 보안 관련 연구자들은 긴급 학회를 열었고, 황정아 더불어민주당 의원이 프랙 보고서를 바탕으로 통신사들을 향해 여러 주의와 경고를 연속 발신했지만 파장은 작았다. 이렇게 중대한 정보 침해 사실이 만천하에 공개됐는데 한국 사회가 그렇게 조용했다는 사실이 믿어지지 않을 정도다. 한국 사회는 정보보안에 이 정도로 무관심했다. 그러다 9월 들어 KT가 무단 소액결제 침해와 롯데카드 개인정보 유출 사태가 터지면서 프랙 보고서도 재조명을 받게 됐다. 상당수 전문가들은 최근 벌어진 일련의 정보침해 사고가 외국 해커의 지속적인 공격과 무관치 않다고 본다. 가장 중요한 것은 국가 기밀과 국민 금융 정보까지 해킹당한 마당이라 앞으로 어떤 피해가 발생할지 모른다는 사실이다. 때문에 지금이라도 철저한 대비가 필요하다. 어떻게 해야 더 이상의 정보보안 침해를 막을 수 있는가에 대해서는 김승주 고려대 정보보호대학원 교수가 한 말을 참고할 필요가 있다. 지난달 24일 최민희 국회 과학기술정보방송통신위원장은 청문회에 출석한 김 교수에게 이례적으로 10분을 주고 평소 소신을 말하라고 했다. 그러자 그는 미사일 대응 군사전략인 ‘3축 체계’를 정보보안에도 도입해야 한다고 주장했다. 킬체인(사전탐지)-한국형미사일방어체계(공중요격)-대량응징보복으로 이뤄진 3축체계를 보안에도 적용해 탐지부터 공격 무력화, 응징까지 이어지는 해킹 방어 시스템을 구축해야 한다는 것이다. 김 교수의 의견대로 정보보호 3축 체계를 완성하려면 컨트롤타워가 필요하다. 현재와 같이 과학기술정보통신부, KISA, 금융위원회, 금융보안원, 국가정보원이 각자 할 일만 하는 시스템으로는 곤란하다. 특히 3축 중 기초에 해당하는 사전탐지는 국내 뿐 아니라 외국의 공격자들을 대상으로 한 화이트해킹 활동이라 전권을 가진 컨트롤타워가 직접 관리하고 책임지는 형태여야만 운영할 수 있다. 이재명 정부는 인공지능(AI)에 집중 투자해 한국 산업이 지속성장할 수 있는 기반을 만든다는 방침이다. AI 세계 3대 강국이 되겠다는 야심찬 계획도 세웠다. 그러나 현재 상황으로 볼 때 AI 투자보다 급한 게 정보보안 체계 재구축으로 보인다. 정보보안 컨트롤타워는 대통령 직속이어도 좋고, 국무총리나 과기부총리 산하여도 괜찮다. 국정원이 해도 좋다. 정부와 정치권은 하루빨리 보안 컨트롤타워 설립을 논의해야 한다. 부국장 겸 IT바이오부장"
롯데 보안사고,머니투데이,2025-10-12 06:00:00,이통3사·빅테크 CEO 줄소환…과방위 국감 최대 화두 '보안·R&D',https://n.news.naver.com/mnews/article/008/0005261217?sid=105,"잇단 해킹에 보안대책 도마 통신사 보상 책임 논란 확산 R&D 예산 삭감 진상 규명 우주항공청 리더십 공백 지적 (왼쪽부터) 유영상 SK텔레콤 대표, 김영섭 KT 대표, 홍범식 LG유플러스 대표. /사진=각 사 국내 이동통신사와 글로벌 빅테크 CEO(최고경영자)들이 국회 국정감사 증인석에 나란히 선다. 13일부터 시작되는 국회 과학기술정보방송통신위원회 국감의 최대 쟁점은 '해킹'과 '정보보안'이다. 지난해 R&D(연구개발) 예산 대규모 삭감 사태와 우주항공 정책 혼선 등 과학기술 분야 현안도 핵심 의제로 다뤄질 전망이다. 과방위는 올해 국감에서 총 92명의 증인과 42명의 참고인을 채택했다. 국감 일정은 오는 13일부터 30일까지 18일간 이어지며, 첫날 세종청사에서 과학기술정보통신부를 대상으로 감사를 시작한다. 이어 방송통신위원회(현 방송미디어통신위원회, 14일), 원자력안전위원회(16일), 우주항공청(17일) 등이 순차적으로 감사 대상에 오른다. 특히 21일에는 KISA(한국인터넷진흥원) 등 보안 관련 기관이 줄줄이 출석해 해킹 대응 능력과 보안 관리 체계 전반이 집중 점검될 예정이다. 이번 증인 명단에는 이통3사 CEO(유영상 SK텔레콤 대표, 김영섭 KT 대표, 홍범식 LG유플러스 대표)가 모두 포함됐다. 이통사들은 최근 발생한 보안 사고의 책임과 함께 소비자 피해 보상 문제에 대해 추궁받을 전망이다. SK텔레콤은 지난 4월 대규모 유심 정보 유출 사고를 겪었고, KT에서는 해킹과 무단 소액결제 피해가 잇따르며 보안 취약성이 다시 부각됐다. 특히 김영섭 대표는 해킹뿐 아니라 지난해 대표 선임 과정에서 정치적 외압 의혹과 관련한 질의에도 직면할 가능성이 있다. 김영섭 KT 대표이사(왼쪽부터), 윤종하 MBK파트너스 부회장, 조좌진 롯데카드 대표이사가 지난달 24일 서울 여의도 국회 과학기술정보방송통신위원회에서 열린 대규모 해킹사고(통신·금융) 관련 청문회에 출석해 증인 선서하고 있다. /사진=뉴스1 금융권도 국감의 주요 의제다. 297만명의 회원 정보가 유출된 롯데카드 해킹 사건과 관련해 조좌진 롯데카드 대표와 최대주주 MBK파트너스의 김병주 회장이 증인으로 채택됐다. 대규모 정보 유출 사고의 경위와 책임, 그리고 재발 방지 대책 마련 여부가 집중적으로 다뤄질 전망이다. 글로벌 빅테크 기업 고위 관계자들도 증언대에 선다. 구글은 유튜브 내 유해 광고 문제와 관련해 윌슨 화이트 아시아태평양 대외정책 총괄 부사장이 출석한다. 애플에서는 마크 리 애플코리아 사장이 앱스토어 수수료와 인앱결제 역차별 문제를 두고 질의에 나설 예정이다. 넷플릭스 역시 강동한 콘텐츠 총괄 부사장과 레지날드 숀 톰슨 넷플릭스서비스코리아 대표가 증인 명단에 이름을 올렸다. 콘텐츠 독점과 국내 소비자 기만행위 논란이 집중적으로 다뤄질 것으로 예상된다. 조성경 전 과학기술정보통신부 1차관이 지난해 10월 25일 서울 여의도 국회에서 열린 과학기술정보방송통신위원회의 과학기술정보통신부, 원자력안전위원회, 우주항공청 등에 대한 종합감사에 참석해 머리를 만지고 있다. /사진=뉴시스 과학기술 분야에서도 민감한 현안이 국감을 통해 다뤄진다. 2023년 R&D 예산 대규모 삭감 사태의 진상을 규명하는 과정에서 조성경 전 과기정통부 제1차관 등 윤석열 정부 주요 과기계 인사들이 증인으로 채택됐다. 과기정통부는 배경훈 장관이 인사청문회 당시 진상조사의 필요성을 인정함에 따라 지난달 'R&D 예산 삭감 진상조사 TF'를 출범했다. 이번 국감에선 TF 보고서를 토대로 책임 소재가 규명될 전망이다. 노종면 더불어민주당 의원실이 최근 TF로부터 받은 보고서에 따르면 과기정통부는 당시 예산 총규모를 유지한 채 일부 항목만 변경한 안을 보고했으나, 최상목 전 대통령실 경제수석이 예산 규모를 60% 줄이라는 지시를 내린 것으로 파악됐다. 신설된 우주항공청에 대해서도 비판이 이어질 전망이다. 우주항공 정책의 '컨트롤타워' 역할을 자임했지만 최근 존 리 우주항공임무본부장이 임기를 채우지 못하고 사퇴하면서 리더십 공백이 발생했다. 또 2030년 첫 발사 예정인 차세대 발사체를 '재사용 발사체'로 전환한다는 계획을 내세우고 있지만 사업 진척이 더딘 상황이라 국회의 지적이 예상된다. 아울러 올해 과방위 국감의 가장 큰 화두는 단연 '보안'이다. 이통사 유심 해킹, 정부 전산망 마비 등 대형 사고가 잇따르면서 공공과 민간을 아우르는 보안 관리 체계가 총체적으로 점검대에 오르고 있다. 국회는 이번 국감을 통해 통신사와 정부의 보안 관리 책임을 엄중히 묻는 한편, R&D 예산 삭감 사태와 우주항공 정책 혼선 등 과학기술 분야의 구조적 문제까지 폭넓게 점검해 제도적 보완책 마련에 나서겠다는 방침이다."
