키워드,언론사,게시일,뉴스제목,url,content
롯데 정보유출,국민일보,2025-09-18 18:44:13,최초 유출 1.7GB선 무슨 정보 털렸는지 몰라… 불안 증폭,https://n.news.naver.com/mnews/article/005/0001803238?sid=101,"해킹 후 서버 내 파일 삭제 특정 불가 카드번호·CVC 등 200GB 추가유출 10개월 무이자 할부 보상책도 뒷말 조좌진 롯데카드 대표이사가 18일 서울 중구 부영태평빌딩에서 열린 기자회견에서 해킹 사고로 인한 고객 정보 유출사태에 대해 사과한 뒤 취재진의 질문에 답하고 있다. 윤웅 기자 롯데카드 해킹 사고로 유출된 정보에 카드번호와 비밀번호(2자리), 유효기간, CVC 등이 포함된 것으로 확인되면서 고객들의 불안이 가시지 않고 있다. 특히 최초로 유출된 1.7GB(기가바이트) 분량의 데이터는 해당 내용을 특정하는 데 실패해 추가 피해 발생 우려도 큰 상황이다. 롯데카드는 18일 서울 중구 부영태평빌딩에서 기자회견을 열어 외부 해커의 온라인 서버 공격으로 297만명의 고객 정보 유출이 새로 확인됐다고 밝혔다. 조좌진 대표는 “200GB 분량의 데이터가 추가로 반출된 정황이 발견됐다”며 “17일 특정 고객의 일부 정보가 유출된 사실을 최종적으로 확인했다”고 말했다. 확인된 유출 개인 정보는 카드번호와 비밀번호(2자리), 유효기간, CVC, 주민등록번호, 생년월일, 전화번호 등이다. 297만명 중 7월 22일부터 8월 27일 사이에 페이결제 서비스나 커머스 사이트에 카드정보를 입력했던 28만명은 결제에 필요한 대부분 정보가 유출돼 부정 사용 가능성이 있다. 단말기에 카드 정보를 직접 입력해 결제하는 방식인 ‘키인(Key in)’ 거래의 경우 부정 사용 가능성을 배제할 수 없다. 특히 상대적으로 인증 절차가 간편한 해외에서 부정 사용 우려가 크다. 국내와 달리 인증 절차가 간편해 이름과 카드번호, 유효기간, CVC 등으로 결제가 가능한 국가들이 있다. 롯데카드는 해외 결제로 인한 피해를 막기 위해 현재 정보가 유출된 고객의 해외 결제를 일괄적으로 차단한 상태다. 조 대표는 “고객이 회사에 전화해 승인을 해 달라고 요청하면 승인을 하는 구조로 움직이고 있다”고 설명했다. 더욱이 지난달 14~15일 반출된 1.7GB 데이터는 유출 내용조차 특정하지 못해 불안을 키우고 있다. 해커가 파일을 유출한 후 서버 내 파일을 삭제해 내용 특정이 불가능하다는 게 회사의 설명이다. 개인정보가 담긴 서버는 아니라는 게 회사 설명이지만, 해당 기간 수만명으로 추정됐던 피해 고객을 특정할 수 없어 불씨를 남겼다는 평가가 나온다. 롯데카드는 정보가 유출된 고객 대상으로 문자를 통해 사실 고지와 카드 재발급 등 조치 사항을 안내 중이다. 부정 사용 가능성이 있는 28만명에게는 최우선으로 카드 재발급 조치를 할 계획이다. 회사는 나머지 269만명은 카드 부정 사용이 발생할 가능성이 없어 재발급은 받을 필요가 없다고 설명했다. 조 대표는 “(269만명은) 일부 항목만 제한적으로 유출돼 카드 재발급을 별도로 할 필요는 없다”며 “그럼에도 불안을 해소하고 싶은 분들은 롯데카드 앱이나 홈페이지를 통해 카드 재발급 등을 신청하면 된다”고 말했다. 롯데카드는 보상책을 함께 발표했으나 비판의 목소리가 크다. 롯데카드는 고객 정보가 유출된 고객을 대상으로 연말까지 10개월 무이자 할부를 제공하겠다고 밝혔다. 부정 사용 가능성이 있는 28만명에게는 카드 재발급 시 다음 해 연회비를 한도 없이 면제하기로 했다. 한 롯데카드 고객은 “롯데카드로 돈을 더 쓰라는 건가 하는 생각이 들어 황당했다”며 “경쟁 카드사의 상시 이벤트 수준”이라고 평가했다. 카드사용 알림서비스 등을 연말까지 무료로 제공한다고 한 것도 보상책에 포함됐는데, 해당 서비스 요금은 월 300원이다. 이날 롯데카드 애플리케이션은 정보 유출을 확인하려는 접속자가 한꺼번에 몰리면서 접속이 지연됐다. 나이스신용평가는 이번 해킹 사건으로 롯데카드가 최대 800억원의 과징금을 부과받을 수 있다고 추산했다. 나신평은 이날 보고서에서 “정보통신망법상 고객정보 유출 시 매출액의 최대 3%까지 과태료 부과가 가능하다”며 이같이 전망했다. 롯데카드 지난해 총 영업수익 약 2조7000억원을 기준으로 3% 과징금이 부과되면 800억원 수준이다. 이는 지난해 롯데카드 당기순이익 1354억원의 60%에 달한다."
롯데 정보유출,MBC,2025-09-18 20:38:36,"'롯데카드' 297만 명 정보 털렸다‥뒤늦은 사과 ""보안 강화하겠다""",https://n.news.naver.com/mnews/article/214/0001450214?sid=101,"[뉴스데스크] ◀ 앵커 ▶ 롯데카드 해킹으로 개인정보가 유출된 피해 고객 수가, 297만 명에 달하는 것으로 확인됐습니다. 롯데카드 대표이사가 직접 사과하고, 부정 사용 등 피해가 발생하면 전액 보상하겠다고 밝혔는데요. 금융 당국은 최대 수준의 제재를 예고했습니다. 김민형 기자가 취재했습니다. ◀ 리포트 ▶ 개인정보가 유출된 고객 수는 297만 명에 달했습니다. 롯데카드 회원 960만 명 중 3분의 1에 해당합니다. 카드번호와 유효기간, 비밀번호 앞 두 자리, 카드 뒷면 CVC 코드는 물론이고 생년월일과 전화번호, 가상결제코드 등 각종 정보가 모두 털렸습니다. 특히 28만 명은 거의 모든 정보가 유출돼 당장 카드를 재발급받아야 합니다. 롯데카드는 유출 정보가 부정하게 사용될 가능성은 낮다고 주장했지만, 대부분의 해외 사이트는 카드번호와 유효기간, CVC 번호 만으로도 결제가 가능합니다. 47만 명은 주민번호 같은 정보가, 222만 명은 암호화된 결제 내역이 유출됐습니다. [조좌진/롯데카드 대표이사] ""고객에게 전가하지 않겠습니다. 저희 롯데카드가 책임지고 피해액 전액을 보상할 것입니다."" 롯데카드는 정보가 유출된 고객 모두에게 최대 10개월 무이자 할부를 제공하고 카드 재발급 대상인 28만 명에게는 연회비를 면제하기로 했습니다. 롯데카드 때문에 피해를 봤는데 카드를 계속 써야 보상을 받는 셈입니다. 미국 등 금융 선진국에서는 개인 정보 유출 사고나 카드 도용 등 사기 거래 발생 시 금융사가 거의 전적으로 책임을 집니다. 때문에 금융사는 보안과 사기거래 방지에 막대한 투자를 합니다. 반면 한국은 보이스피싱 등 사기 거래는 물론이고, 보안 책임도 복잡한 인증 절차를 통해 고객에게 떠넘기는 게 현실입니다. [김명주/서울여대 지능정보보호학부 교수] ""미국 같은 경우는 집단소송제가 발달돼 있어서 피해자 한두 명이 소송을 걸면 그 피해를 받았던 전체가 다 똑같이 배상을 받거든요."" 롯데카드는 앞으로 보안 강화에 1천억 원 이상 투자하겠다고 밝혔습니다. 이번 해킹은 2017년에 보안취약점이 확인된 서버에서 일어났고, 고객의 주민번호와 비밀번호 등 민감한 정보는 이미 유출됐습니다. 금융당국은 이번 사태에 대해 ""일벌백계하겠다""며 최대 수준의 제재를 예고했습니다. 또 중대한 보안 사고가 일어나면 징벌적 과징금을 매기는 제도 도입을 추진하기로 했습니다. MBC뉴스 김민형입니다. 영상취재: 조윤기 / 영상편집: 박문경 MBC 뉴스는 24시간 여러분의 제보를 기다립니다. ▷ 전화 02-784-4000 ▷ 이메일 mbcjebo@mbc.co.kr ▷ 카카오톡 @mbc제보"
롯데 정보유출,한국경제,2025-09-18 17:38:14,"롯데카드, 297만명 정보 털렸다…28만명은 CVC 유출",https://n.news.naver.com/mnews/article/015/0005186953?sid=101,"회원 30%가 해킹 피해…조좌진 대표 '대국민 사과' ""부정 사용 발생 땐 전액보상"" 데이터 유출 한참 지나서야 파악 해킹규모도 예상보다 100배 많아 피해 고객엔 10개월 무이자 할부 5년간 정보보호에 1100억 투자 금융당국은 ""엄정제재"" 예고 수익에만 치중해 보안투자 소홀 과징금 최대 800억 내야할 수도 < 고개숙인 롯데카드 경영진 > 조좌진 롯데카드 대표(왼쪽 네 번째)와 ﻿경영진이 18일 고객 개인정보 유출 사태에 대해 고개 숙여 사과하고 있다.  /김범준 기자 롯데카드 해킹 피해 고객이 300만 명에 달하는 것으로 확인됐다. 롯데카드 전체 회원(967만 명) 기준 세 명 중 한 명은 개인정보가 유출됐다는 얘기다. 카드업계에서 발생한 해킹 피해 규모로는 2014년 카드 3사 대량 개인정보 유출 사태 이후 최대 수준이다. 카드번호와 카드고유확인번호(CVC) 등 민감 정보까지 유출된 것으로 나타나자 금융당국은 롯데카드에 엄정 제재를 예고했다. ◇카드 비밀번호까지 대거 유출 조좌진 롯데카드 대표는 18일 서울 태평로 부영태평빌딩에서 기자회견을 열고 “금융감독원과 금융보안원이 합동 조사한 결과 200GB에 달하는 고객 정보가 추가적으로 반출된 정황이 발견됐다”며 “고객 여러분과 유관 기관 여러분께 심려를 끼쳐 진심으로 죄송하다”고 고개를 숙였다. 롯데카드에 따르면 이번 해킹 피해를 본 고객은 297만 명이다. 이 가운데 28만 명은 카드번호, 비밀번호, 유효기간, CVC, 주민등록번호 등 민감한 정보가 대거 유출됐다. 이들은 7월 22일부터 8월 27일까지 새로운 페이 결제 서비스나 쇼핑몰에서 카드 정보를 새로 등록한 것으로 파악됐다. 조 대표는 “그 정보가 오프라인 결제에 부정 사용될 소지는 없다”며 “단말기에 카드 정보를 직접 입력해 결제하는 방식인 일부 키인(key in) 거래에선 부정 사용 가능성이 존재한다”고 밝혔다. 이어 “현재까지 부정 사용 사례는 확인되지 않았다”고 덧붙였다. 해킹이 발생한 건 지난달 14일이다. 하지만 롯데카드가 처음 인지한 건 같은 달 26일이었다. 온라인 결제 서버에서 외부 침입 흔적이 발견됐다. 롯데카드 측은 전체 서버를 대상으로 정밀 조사했고, 3개 서버에서 악성코드와 웹셸을 발견해 삭제했다. 당시까지만 해도 고객 정보 유출 정황은 확인되지 않았다. 이후 31일 약 1.7GB 분량의 데이터 반출 흔적이 포착됐다. 하지만 초기 조사에서는 고객 정보 유출은 드러나지 않았다. 롯데카드는 다음 날인 이달 1일 금감원과 금융보안원에 해킹 사실을 신고했다. 이튿날부터 금감원과 금융보안원의 현장 검사가 이뤄졌고 조사 과정에서 200GB 분량의 데이터가 추가로 반출된 정황이 발견됐다. 이번 해킹은 롯데카드가 7월 정보보호 관리체계 인증(ISMS)을 받은 지 불과 한 달 만에 벌어졌다. 조 대표는 “해커가 교묘하게 짧은 공격을 반복해 파일을 잘게 나눠 가져갔고, 그 파일이 대부분 암호화돼 있었다”며 “이를 하나하나 해독해 고객별 로그 데이터를 정리하고 어떤 고객의 어떤 정보가 유출됐는지 매칭하는 데 시간이 오래 걸렸다”고 해명했다. ◇과징금 규모 막대할 듯 롯데카드는 부정 사용으로 피해가 발생하면 전액을 보상할 방침이다. 개인정보 유출 고객 전원에게는 10개월 무이자 할부, 재발급 연회비 면제 등 구체적인 보상 방안을 내놨다. 또 향후 5년간 1100억원 규모 정보보호 관련 투자를 집행하겠다고 밝혔다. 하지만 대규모 제재는 피하기 어려울 것으로 예상된다. 특히 2017년 도입된 보안 패치가 해외 결제 시스템에 적용되지 않은 점이 이번 해킹의 원인으로 지목돼 롯데카드가 보안 투자에 뒷전이었다는 비판이 제기됐다. 여기에 2019년 롯데카드를 인수한 사모펀드 MBK파트너스의 책임론도 불거졌다. 윤한홍 국민의힘 의원에 따르면 롯데카드의 지난해 말 네트워크 보안 지출액은 116억원으로 2021년(137억원) 대비 14.7% 줄어든 것으로 나타났다. 금융당국은 이날 긴급회의를 열고 “일벌백계 원칙하에 엄정 제재하겠다”고 밝혔다. 나이스신용평가는 “영업수익 등을 고려하면 롯데카드가 해킹 사고로 최대 800억원의 과징금을 부과받을 가능성이 있다”고 예상했다. 이는 올해 롯데카드의 상반기 영업이익(590억원)을 훌쩍 뛰어넘는다. 이번 해킹 사태로 롯데카드 매각 작업도 난항을 겪을 전망이다. MBK파트너스는 2022년 JP모간을 주관사로 선정해 첫 매각을 시도했지만 무산됐다. 재매각을 위해 예비 입찰 등을 진행했지만 마땅한 인수자를 찾지 못한 것으로 알려졌다."
롯데 정보유출,한겨레,2025-09-18 13:56:20,‘해킹’ 롯데카드 297만명 정보 유출…28만명 CVC까지 털려,https://n.news.naver.com/mnews/article/028/0002767016?sid=101,"“28만명은 부정 사용 가능성 있어…피해 전액 보상” 조좌진 롯데카드 대표이사(맨 오른쪽)와 임원진이 18일 오후 서울 중구 부영태평빌딩에서 기자회견을 열어 롯데카드 해킹 사고에 대해 사과하며 고개 숙이고 있다. 최현수 기자 emd@hani.co.kr 롯데카드는 해킹 공격으로 전체 회원 중 3분의 1에 가까운 297만명의 회원 정보 200기가바이트가 유출됐다고 18일 밝혔다. 이 가운데 28만명은 카드번호·유효기간과 함께 보안코드(CVC)까지 유출돼 부정 사용 가능성이 있는 것으로 확인됐다. 조좌진 롯데카드 대표는 이날 오후 서울 중구 부영태평빌딩에서 기자회견을 열어 이같이 밝히고 “고객 여러분과 유관 기관 여러분께 심려를 끼쳐 진심으로 죄송하다”고 밝혔다. 조좌진 롯데카드 대표이사가 18일 오후 서울 중구 부영태평빌딩에서 열린 롯데카드 해킹 사고 사과 기자회견에서 사과문을 발표하고 있다. 최현수 기자 emd@hani.co.kr 이번에 유출된 회원 정보는 온라인 결제 과정에서 생성·수집된 데이터로 연계 정보(CI), 주민등록번호, 가상 결제코드, 내부 식별번호, 간편결제 서비스 종류 등이다. 정보 유출은 온라인 결제 서버에 국한해 발생해 오프라인 결제와는 무관하다고 조 대표는 설명했다. 다만 CVC까지 유출된 28만명의 경우는 통상 2차 인증이 필요해 부정사용이 쉽진 않지만, 단말기에 카드정보를 직접 입력해 결제하는 방식으로는 부정사용 가능성이 존재한다. 조 대표는 “이번 사고로 발생한 피해에 대해선 롯데카드가 책임지고 피해액 전액을 보상할 것”이라며 “2차 피해도 연관성이 확인되면 전액 보상하겠다”고 말했다. 롯데카드는 정보가 유출된 고객 전원에게는 연말까지 금액과 상관없이 무이자 10개월 할부 서비스를 제공하겠다고 했다."
롯데 정보유출,KBS,2025-09-18 21:24:37,롯데카드 3백만 명 정보 유출…28만 명은 비번도 털려,https://n.news.naver.com/mnews/article/056/0012032418?sid=101,"[앵커] 롯데카드 해킹 피해가 당초 알려졌던 것보다 훨씬 큽니다. 3백만 명 가까이 개인정보가 유출됐습니다. 또 카드를 해지하거나 재발급해야 할 고객이 적지 않습니다. 자세한 내용을 황현규 기자가 설명해드립니다. [리포트] 해킹은 지난달 14일 시작됐습니다. 악성코드로 온라인 결제 서버를 뚫었고, 해커들은 야금야금 고객 개인정보를 빼갔습니다. 롯데카드가 서버를 점검한 27일까지 계속됐습니다. 확인된 피해 고객은 롯데카드 회원의 30%인 297만여 명. 주민등록번호, 고객별 고유번호, 가상결제코드 등이 빠져 나갔습니다. 지난 4월 SK텔레콤 해킹과 비교하면, 피해 인원은 3분의 1 수준이지만, 유출 데이터는 20배였습니다. 개인정보가 집적되는 금융사가 특히 위험한 이유입니다. [조좌진/롯데카드 대표이사 : ""해당 정보만으로 카드 부정사용이 발생할 가능성이 없음을 확인하였습니다.""] 하지만, 28만여 명은 상황이 다릅니다. 실물 카드를 기준으로 앞면의 카드번호 16자리와 유효기간, 뒷면의 3자리, CVC 번호에다 비밀번호 앞 2자리까지  유출됐기 때문입니다. 실물 카드가 없어 일반적인 결제는 불가능하지만, 전화로 번호를 불러주는 식의 '특수결제'는 가능합니다. 롯데카드 고객이라면 피해를 막기 위해 이렇게 하면 좋습니다. 먼저, 홈페이지나 앱 등을 통해 정보 유출 여부를 확인하고, 정보가 유출됐다면 비밀번호 변경과 해외거래 차단은 꼭 해야 합니다. 부정결제 여지가 있는 28만 명에 포함됐단 문자를 받았다면, 카드 재발급이나 해지를 고려하는 게 좋습니다. [이창주/롯데카드 리스크관리본부장 : ""당사에 접수를 하게 되면 접수된 전 건에 대해서는 먼저 보상을 하고 있습니다.""] 롯데카드는 이번 해킹으로 인한 부정결제는 아직은 없다고 밝혔습니다. KBS 뉴스 황현규입니다. 촬영기자:김보현/영상편집:김인수 ■ 제보하기 ▷ 전화 : 02-781-1234, 4444 ▷ 이메일 : kbs1234@kbs.co.kr ▷ 카카오톡 : 'KBS제보' 검색, 채널 추가 ▷ 네이버, 유튜브에서 KBS뉴스를 구독해주세요!"
롯데 정보유출,한국경제,2025-09-18 14:02:18,롯데카드 297만명 정보 유출…카드번호·CVC까지 털렸다 [영상],https://n.news.naver.com/mnews/article/015/0005186742?sid=102,"롯데카드가 해킹 공격 피해 조사 결과 297만명의 회원 정보가 유출된 것으로 확인했다고 밝혔다. 전체 960만명의 회원 가운데 약 3분의 1에 가까운 회원 정보가 유출된 셈이다. 이 가운데 카드번호, 유효기간, CVC번호 등까지 유출돼 카드 부정 사용 발생 가능성이 있는 회원은 28만명으로 확인됐다. 사진=연합뉴스 조좌진 롯데카드 대표는 18일 오후 서울 중구 부영태평빌딩에서 기자회견을 열어 이같이 밝히고 ""고객 여러분과 유관 기관 여러분께 심려를 끼쳐 진심으로 죄송하다""고 사과했다. 유출이 확인된 회원 정보는 온라인 결제 과정에서 생성·수집된 데이터로 연계 정보(CI), 주민등록번호, 가상 결제코드, 내부 식별번호, 간편결제 서비스 종류 등이다. 조 대표는 ""전체 유출 고객 중 유출된 고객 정보로 카드 부정 사용이 발생할 가능성이 있는 고객은 총 28만명""이라며 ""유출 정보 범위는 카드번호, 유효기간, CVC번호 등""이라고 말했다. 이어 ""나머지 269만명은 일부 항목만 제한적으로 유출됐다""며 ""해당 정보만으로 카드 부정 사용이 발생할 가능성은 없다""고 덧붙였다. 정보 유출은 온라인 결제 서버에 국한해 발생했으며, 오프라인 결제와는 전혀 무관하다고 설명하기도 했다. 피해 구제 방안으로는 전액 보상 방침을 밝혔다. 조 대표는 ""이번 사고로 발생한 피해는 롯데카드가 책임지고 피해액 전액을 보상할 것""이라며 ""2차 피해도 연관성이 확인되면 전액 보상하겠다""고 말했다. 또 고객 정보가 유출된 고객 전원에게 연말까지 결제 금액과 관계없이 무이자 10개월 할부 서비스를 무료로 제공하기로 했다. 사진=SNS 캡처 온라인을 통해 개인정보 유출 여부 확인 페이지를 캡처한 화면도 공유되고 있다. 카드번호, 유효기간, CVG, 주민등록번호, 가상결제코드, 결제요청금액, 간편결제서비스 구분, 비밀번호(앞2자리) 등 유출 범위 안내와 함께 '만에 하나 이번 침해 사고로 인해 부정사용이 발생할 경우, 피해액 전액 보상을 약속드린다'는 문구가 표시됐다. 일부에게는 '회원님의 유출 정보로 부정 사용이 될 위험은 낮다'는 문구도 더해졌다. 네티즌들은 유출 규모가 크고, 범위 또한 피해가 우려될 정도라며 걱정하고 있다. 아울러 롯데카드 측에서 유출 고객 전원에게 내건 '연말까지 무이자 10개월 할부 서비스' 역시 사안에 비해 부실한 보상 방침이 아니냐며 지적하고 있다. 앞서 롯데카드는 지난 1일 해킹 공격을 당해 1.7GB 규모의 데이터가 유출됐다고 금융당국에 신고했다. 조사 결과 실제 유출 규모는 이보다 훨씬 큰 것으로 드러났으며, 처음 해킹 사고가 발생한 것은 지난달 14일이었으나 회사 측은 월말이 돼서야 사태를 파악하고 조사에 나선 것으로 전해졌다. 조 대표는 사고 경과와 관련 ""8월 26일 온라인 결제 서버에서 외부 해커 침해 흔적을 발견했다""며 ""31일 1.7GB 분량의 데이터 반출을 시도한 흔적을 발견했다""고 설명했다. 이어 ""9월 2일부터 금융감독원과 금융보안원 현장 검사가 진행됐고, 200GB 분량의 데이터가 추가 반출된 정황을 발견했다""며 ""어제 특정 고객의 일부 고객 정보가 유출된 사실을 최종 확인했다""고 전했다. 아울러 ""고객 피해 제로화를 최우선 과제로 삼고 대표이사 주재로 전사적 비상대응체계를 가동하겠다""면서 앞으로 5년 동안 1100억원 규모의 정보보호 관련 투자를 집행, 자체 보안 관제 체계를 구축하겠다고 밝혔다."
롯데 정보유출,이데일리,2025-09-18 18:18:15,롯데카드 297만명 정보 유출…28만명 비번까지 털려,https://n.news.naver.com/mnews/article/018/0006119220?sid=101,"카드번호·뒷면 CVC도 유출 李 ""범정부 대책 마련하라"" [이데일리 김국배 기자] 롯데카드 해킹 사고로 297만명에 이르는 고객 정보가 유출된 것으로 확인됐다. 특히 28만명은 카드번호, CVC 번호, 카드비밀번호 등이 유출돼 부정사용 피해 가능성에 노출된 상황이다. 이재명 대통령은 “주요 통신사, 금융기관에 대한 해킹으로 국민 피해가 늘고 있다”며 범정부 차원의 종합 대책 마련을 지시했다. 조좌진 롯데카드 대표이사 사장이 18일 서울 중구 부영태평빌딩에서 사이버 침해 사고에 대한 대고객 사과를 하고 있다. (사진=뉴시스) 조좌진 롯데카드 대표는 18일 기자회견을 열고 해킹 사고와 관련해 대국민 사과했다. 롯데카드가 정보 유출 피해를 인지한 지 18일 만이다. 조 대표는 “이번 사고로 발생한 피해액에 대해서 책임지고 피해액 전액을 보상하겠다”고 밝혔다. 롯데카드는 애초 당국에 해킹 피해 사실을 신고하며 유출 규모를 1.7기가바이트(GB) 수준이라고 했지만 실제 유출 규모는 200GB에 달했다. 보상안으로는 부정 사용 가능성이 있는 고객에게 카드 재발급 시 다음 연도 연회비를 면제하고 유출 고객 전원에게 무이자 10개월 할부를 제공한다. ‘징벌적 과징금’ 가능성까지 거론되며 금전적 부담이 커질 전망이다. 롯데카드가 가입한 개인정보 배상책임 보험은 보장 범위가 법률비로 제한적이며 신용정보 유출까지 보장하지 않는다. 홍시우 법무법인 대륙아주 변호사는 “약 10년 전부터 알려진 결제관리 서버의 취약점을 방치한 데다 해킹 인지가 17일이나 지연된 점 등 롯데카드의 행위가 ‘중대한 과실’에 해당할 가능성이 있기 때문에 징벌적 손해배상 가능성이 열려 있다”고 했다. 금융위원회는 이날 긴급 대책회의를 열어 전 금융권의 보안 관리 태세를 긴급 점검하기로 했다. 롯데카드에 대해선 금융감독원 검사를 통해 허술한 보안 관리 사항을 발견하면 “최대 수준의 엄정한 제재가 이뤄지도록 하겠다”고 했다."
롯데 정보유출,파이낸셜뉴스,2025-09-19 14:56:21,"경찰, '롯데카드 해킹·정보유출' 수사",https://n.news.naver.com/mnews/article/014/0005409495?sid=102,"(출처=연합뉴스) [파이낸셜뉴스] 경찰이 롯데카드 해킹 사건을 수사하고 있다. 경찰청 국가수사본부 사이버테러수사대는 관련 언론 보도가 나온 이달 초부터 사건을 인지해 수사 중이라고 19일 밝혔다. 경찰은 우선 카드사 고객 정보가 얼마나, 어떤 경로로 탈취됐는지 파악한 뒤 해킹범을 추적할 예정이다. 롯데카드는 외부 해킹 공격으로 297만명의 고객 정보가 유출됐다고 전날 발표했다. 이 중 28만명은 카드번호와 비밀번호, 유효기간, 카드보안코드(CVC), 주민등록번호 등이 유출됐다."
